センター,可燃物,ビニール・プラスチック（プラマークあり）,ビニール・プラスチック（プラマークなし）,金物,ガラス,ペットボトル,陶磁器,
東町・本町・早苗町,月 木,金1 金3 金4 金5,金2,火1,火2,火3,20190528 20190827 20191126 20200225,
中町・大山,月 木,金1 金3 金4 金5,金2,火3,火1,火2,20190528 20190827 20191126 20200225,
門屋・塩原・合戸,月 木,金1 金3 金4 金5,金2,火2,火3,火1,20190528 20190827 20191126 20200225,
佐倉,月 木,水1 水3 水4 水5,水2,金1,金2,金3,20190524 20190823 20191122 20200228,
比木・朝比奈・新野,月 木,水1 水3 水4 水5,水2,金3,金1,金2,20190524 20190823 20191122 20200228,
上岬区・下岬区・大山区・西側区,火 金,月1 月3 月4 月5,月2,水2,水3,水1,20190522 20190828 20191127 20200226,
女岩区・広沢区・新谷区・薄原区,火 金,月1 月3 月4 月5,月2,水3,水1,水2,20190522 20190828 20191127 20200226,
中原区・白羽区・白浜区・新神子区,火 金,月1 月3 月4 月5,月2,水1,水2,水3,20190522 20190828 20191127 20200226,
